{
  "type": "question",
  "state": "open",
  "id": "hrm:question/skin-substitutes-improve-scar-quality-not-just-closure",
  "projections": [
    "universal-repair"
  ],
  "question": "Do bioengineered skin substitutes improve the quality of the healed skin (scar scale, appendages, sensation) rather than only the rate of closure?",
  "why": "Closure is the endpoint that got them approved; quality is what regeneration means. The trials on this map did not measure it.",
  "blocks": [
    "hrm:capability/dermal-substitute-for-chronic-wound-closure"
  ],
  "whatWouldResolve": "A randomised trial with a validated scar-quality primary endpoint at 12 months.",
  "provenance": {
    "proposedBy": {
      "type": "ai",
      "name": "Claude Code session e7dc5601 (Anthropic)",
      "model": "claude-opus-5",
      "session": "e7dc5601-1690-47c6-bf13-9ca150d31960"
    },
    "method": "manual reasoning from the cited sources' abstracts (PubMed) and Crossref metadata, checked 2026-09-11; no source opened at figure level",
    "date": "2026-09-11"
  },
  "review": {
    "state": "ai-proposed",
    "date": "2026-09-11"
  }
}
