{
  "type": "question",
  "state": "open",
  "id": "hrm:question/gene-corrected-epidermal-graft-long-term-safety",
  "projections": [
    "universal-repair"
  ],
  "question": "Do gene-corrected epidermal stem-cell grafts remain stable and free of clonal or malignant events beyond five years?",
  "why": "Retroviral integration in long-lived stem cells is the safety question that decides whether the approach can be offered widely.",
  "blocks": [
    "hrm:capability/epidermis-gene-corrected-stem-cell-replacement"
  ],
  "whatWouldResolve": "Integration-site analysis and clinical follow-up beyond five years in the treated patients, published.",
  "provenance": {
    "proposedBy": {
      "type": "ai",
      "name": "Claude Code session e7dc5601 (Anthropic)",
      "model": "claude-opus-5",
      "session": "e7dc5601-1690-47c6-bf13-9ca150d31960"
    },
    "method": "manual reasoning from the cited sources' abstracts (PubMed) and Crossref metadata, checked 2026-09-11; no source opened at figure level",
    "date": "2026-09-11"
  },
  "review": {
    "state": "ai-proposed",
    "date": "2026-09-11"
  }
}
