{
  "type": "question",
  "state": "open",
  "id": "hrm:question/partial-reprogramming-human-safety",
  "projections": [
    "rejuvenation"
  ],
  "question": "Can partial epigenetic reprogramming rejuvenate a human tissue without dedifferentiation, loss of cell identity or tumour formation?",
  "why": "It is the first rejuvenation mechanism to reach a human; its safety window decides whether the rejuvenation map has a therapeutic root at all.",
  "blocks": [
    "hrm:capability/safe-partial-epigenetic-reprogramming-in-vivo",
    "hrm:capability/cell-identity-retention-under-partial-reprogramming",
    "hrm:goal/systemic-rejuvenation"
  ],
  "hypotheses": [
    "A controlled expression window exists in humans as it does in mice.",
    "Human cells require longer exposure for effect, which overlaps the dedifferentiation window."
  ],
  "knownUnknowns": [
    "safe expression window",
    "delivery efficiency to the target cells",
    "long-term epigenetic stability"
  ],
  "whatWouldResolve": "Phase 1 safety data plus any functional signal from the first OSK trial (NCT07290244), then a functional endpoint in a controlled study.",
  "provenance": {
    "proposedBy": {
      "type": "ai",
      "name": "Claude Code session e7dc5601 (Anthropic)",
      "model": "claude-opus-5",
      "session": "e7dc5601-1690-47c6-bf13-9ca150d31960"
    },
    "method": "manual reasoning from the cited sources' abstracts (PubMed) and Crossref metadata, checked 2026-09-11; no source opened at figure level",
    "date": "2026-09-11"
  },
  "review": {
    "state": "ai-proposed",
    "date": "2026-09-11"
  }
}
