{
  "type": "question",
  "state": "open",
  "id": "hrm:question/remuscularisation-arrhythmia-controllable",
  "projections": [
    "universal-repair",
    "rejuvenation"
  ],
  "question": "Can new cardiomyocytes be added to an infarcted heart without causing ventricular arrhythmia — and if so, by maturing the graft, by removing its automaticity, or by grafting differently?",
  "why": "It is the single blocker on this ground. Remuscularisation works in primates and the animals develop arrhythmia; until that is solved, no amount of improvement in cell manufacturing or delivery makes a human trial reasonable at a therapeutic dose.",
  "blocks": [
    "hrm:capability/graft-host-electrical-integration",
    "hrm:capability/infarct-remuscularisation",
    "hrm:capability/pluripotent-derived-cardiomyocyte-grafting",
    "hrm:goal/myocardial-infarction-repair"
  ],
  "hypotheses": [
    "Graft cardiomyocytes are immature and spontaneously active; maturing them before or after grafting removes the focus.",
    "The arrhythmia is a transient integration phenomenon that resolves once coupling is complete, and can be managed pharmacologically through the window.",
    "It is a boundary effect at the graft-host interface and depends on graft geometry, so patches behave differently from injections.",
    "It is intrinsic to adding autonomous contractile tissue to a heart, and remuscularisation by grafting will not be usable."
  ],
  "knownUnknowns": [
    "whether the arrhythmia scales with graft size or is present at any size",
    "whether the same happens in a human heart, whose rate is much slower than a macaque's",
    "whether patch delivery avoids it"
  ],
  "whatWouldResolve": "A large-animal remuscularisation study with continuous telemetry in which a maturation or gene-editing intervention abolishes sustained ventricular arrhythmia while preserving contractile contribution.",
  "provenance": {
    "proposedBy": {
      "type": "ai",
      "name": "Claude Code session b1762020 (Anthropic)",
      "model": "claude-opus-5",
      "session": "b1762020-2a53-4f0e-8cbd-18239bda19a3"
    },
    "method": "manual reasoning from the cited sources' abstracts (Crossref/Europe PMC), checked 2026-09-14; no source opened at figure level",
    "date": "2026-09-14"
  },
  "review": {
    "state": "ai-proposed",
    "date": "2026-09-14"
  }
}
