{
  "type": "question",
  "state": "open",
  "id": "hrm:question/healthy-target-state-for-aged-tissue",
  "projections": [
    "rejuvenation"
  ],
  "question": "What counts as the healthy target state for an aged person's tissue — youthful architecture, age-appropriate function, or something the person defines?",
  "why": "Target-state content is human-gated on this map (ai-collaboration.md §4). The question is recorded so the dependency is visible; it is not for a model to resolve.",
  "blocks": [
    "hrm:goal/systemic-rejuvenation",
    "hrm:goal/rejuvenation"
  ],
  "hypotheses": [
    "A population reference state at a younger age.",
    "The person's own earlier state, where records exist.",
    "A personalised optimum co-defined with the person, including what must not change."
  ],
  "whatWouldResolve": "A published, reviewed target-state framework adopted by a rejuvenation trial as its endpoint definition.",
  "provenance": {
    "proposedBy": {
      "type": "ai",
      "name": "Claude Code session e7dc5601 (Anthropic)",
      "model": "claude-opus-5",
      "session": "e7dc5601-1690-47c6-bf13-9ca150d31960"
    },
    "method": "manual reasoning from the cited sources' abstracts (PubMed) and Crossref metadata, checked 2026-09-11; no source opened at figure level",
    "date": "2026-09-11"
  },
  "review": {
    "state": "ai-proposed",
    "date": "2026-09-11"
  }
}
