{
  "type": "question",
  "state": "open",
  "id": "hrm:question/regenerated-skin-sensory-reinnervation",
  "projections": [
    "universal-repair",
    "rejuvenation"
  ],
  "question": "Does regenerated or grafted skin regain sensory innervation comparable to uninjured skin, and what limits it?",
  "why": "Skin without sensation is injured skin. Reinnervation is required for function and is rarely measured as an endpoint.",
  "blocks": [
    "hrm:capability/cutaneous-sensory-reinnervation"
  ],
  "whatWouldResolve": "Quantitative sensory testing plus nerve-fibre density on biopsy in regenerated versus uninjured skin at one year.",
  "provenance": {
    "proposedBy": {
      "type": "ai",
      "name": "Claude Code session e7dc5601 (Anthropic)",
      "model": "claude-opus-5",
      "session": "e7dc5601-1690-47c6-bf13-9ca150d31960"
    },
    "method": "manual reasoning from the cited sources' abstracts (PubMed) and Crossref metadata, checked 2026-09-11; no source opened at figure level",
    "date": "2026-09-11"
  },
  "review": {
    "state": "ai-proposed",
    "date": "2026-09-11"
  }
}
