{
  "type": "question",
  "state": "open",
  "id": "hrm:question/motor-sensory-mistargeting-after-repair",
  "projections": [
    "universal-repair"
  ],
  "question": "How much of the functional loss after a repaired nerve is mistargeting — motor axons entering sensory pathways and the wrong muscles — and can regrowth be guided to the correct fascicle?",
  "why": "If the axons arrive but arrive in the wrong place, then bridging and speed are solved problems and the map's attention belongs on guidance instead.",
  "blocks": [
    "hrm:capability/axon-regrowth-across-a-repair",
    "hrm:capability/sensory-target-reinnervation-with-discrimination"
  ],
  "hypotheses": [
    "Mistargeting dominates the residual deficit in mixed nerves, and fascicle-matched repair or selective guidance would recover most of it.",
    "Mistargeting is largely corrected centrally by cortical remapping in the young and not in adults.",
    "Mistargeting is minor next to the time-dependent loss of the target."
  ],
  "whatWouldResolve": "Retrograde tracing in a large-animal mixed-nerve repair quantifying how many motor neurons reach motor targets, paired with human functional outcome under fascicle-matched versus conventional repair.",
  "provenance": {
    "proposedBy": {
      "type": "ai",
      "name": "Claude Code session b1762020 (Anthropic)",
      "model": "claude-opus-5",
      "session": "b1762020-2a53-4f0e-8cbd-18239bda19a3"
    },
    "method": "manual reasoning from the cited sources' abstracts (Crossref/Europe PMC), checked 2026-09-14; no source opened at figure level",
    "date": "2026-09-14"
  },
  "review": {
    "state": "ai-proposed",
    "date": "2026-09-14"
  }
}
