{
  "type": "question",
  "state": "open",
  "id": "hrm:question/wound-induced-hair-neogenesis-in-human-skin",
  "projections": [
    "universal-repair",
    "rejuvenation"
  ],
  "question": "Can de novo hair follicle neogenesis occur in adult human wounds, or is it lost with development?",
  "why": "Appendage regeneration is the visible difference between regeneration and scar. Mouse large wounds do it; if human skin cannot, appendages must come from a graft instead.",
  "blocks": [
    "hrm:capability/hair-follicle-neogenesis-after-wounding"
  ],
  "hypotheses": [
    "Human skin retains the competence and lacks the trigger (wound size, Wnt).",
    "Competence is lost postnatally in humans."
  ],
  "whatWouldResolve": "Documented follicle neogenesis, distinguished from survival of pre-existing follicles, in a large adult human wound or a human skin xenograft.",
  "provenance": {
    "proposedBy": {
      "type": "ai",
      "name": "Claude Code session e7dc5601 (Anthropic)",
      "model": "claude-opus-5",
      "session": "e7dc5601-1690-47c6-bf13-9ca150d31960"
    },
    "method": "manual reasoning from the cited sources' abstracts (PubMed) and Crossref metadata, checked 2026-09-11; no source opened at figure level",
    "date": "2026-09-11"
  },
  "review": {
    "state": "ai-proposed",
    "date": "2026-09-11"
  }
}
