{
  "type": "question",
  "state": "open",
  "id": "hrm:question/rejuvenation-reach-beyond-eye-and-liver",
  "projections": [
    "rejuvenation"
  ],
  "question": "Can a rejuvenation payload reach tissues beyond the eye and liver — heart, brain, muscle — at useful efficiency?",
  "why": "Systemic rejuvenation is gated by delivery. The eye is chosen first because it is reachable; the tissues that matter for lifespan are not.",
  "blocks": [
    "hrm:capability/systemic-cell-type-specific-delivery",
    "hrm:goal/systemic-rejuvenation"
  ],
  "whatWouldResolve": "Cell-type-specific transduction quantified in a non-ocular human tissue from a systemic dose, by any group.",
  "provenance": {
    "proposedBy": {
      "type": "ai",
      "name": "Claude Code session e7dc5601 (Anthropic)",
      "model": "claude-opus-5",
      "session": "e7dc5601-1690-47c6-bf13-9ca150d31960"
    },
    "method": "manual reasoning from the cited sources' abstracts (PubMed) and Crossref metadata, checked 2026-09-11; no source opened at figure level",
    "date": "2026-09-11"
  },
  "review": {
    "state": "ai-proposed",
    "date": "2026-09-11"
  }
}
