{
  "type": "question",
  "state": "open",
  "id": "hrm:question/organised-microvasculature-in-thick-regenerated-tissue",
  "projections": [
    "universal-repair",
    "rejuvenation"
  ],
  "question": "Can an organised, hierarchical, perfused microvascular network be induced throughout regenerated or engineered dermis thicker than the diffusion limit, in humans, with normal geometry and long-term stability?",
  "why": "Without it, any regenerated tissue thicker than a few hundred micrometres dies in the middle. It gates dermal regeneration, engineered grafts and every thick-tissue repair on the universal map.",
  "blocks": [
    "hrm:capability/organised-microvascular-network-in-regenerated-dermis",
    "hrm:capability/appendage-bearing-skin-from-pluripotent-cells"
  ],
  "hypotheses": [
    "Prevascularised constructs anastomose fast enough if the network is pre-patterned.",
    "Host angiogenesis can be driven to hierarchy by controlled growth-factor gradients.",
    "Only surgical microvascular connection (flaps) will work at clinical scale."
  ],
  "whatWouldResolve": "A thick (>2 mm) regenerated or engineered dermis in a large animal or human with perfusion measured throughout at six months and vessel hierarchy on histology.",
  "provenance": {
    "proposedBy": {
      "type": "ai",
      "name": "Claude Code session e7dc5601 (Anthropic)",
      "model": "claude-opus-5",
      "session": "e7dc5601-1690-47c6-bf13-9ca150d31960"
    },
    "method": "manual reasoning from the cited sources' abstracts (PubMed) and Crossref metadata, checked 2026-09-11; no source opened at figure level",
    "date": "2026-09-11"
  },
  "review": {
    "state": "ai-proposed",
    "date": "2026-09-11"
  }
}
