{
  "type": "question",
  "state": "open",
  "id": "hrm:question/cancer-risk-of-repeated-partial-reprogramming",
  "projections": [
    "rejuvenation"
  ],
  "question": "What is the cancer risk of repeated partial reprogramming in aged human tissue, and can it be bounded by a stopping rule?",
  "why": "Rejuvenation and oncogenesis share machinery. Nobody will accept a rejuvenation treatment in healthy people without an answer, and the answer is only observable over years.",
  "blocks": [
    "hrm:capability/cancer-risk-control-under-rejuvenation",
    "hrm:goal/systemic-rejuvenation"
  ],
  "knownUnknowns": [
    "dose–response for transformation",
    "interaction with pre-existing clonal expansions in aged tissue",
    "whether a biomarker of proliferative drift exists"
  ],
  "whatWouldResolve": "Long-term cancer incidence in treated versus untreated aged animals and, eventually, humans; and a validated early biomarker of transformation risk.",
  "provenance": {
    "proposedBy": {
      "type": "ai",
      "name": "Claude Code session e7dc5601 (Anthropic)",
      "model": "claude-opus-5",
      "session": "e7dc5601-1690-47c6-bf13-9ca150d31960"
    },
    "method": "manual reasoning from the cited sources' abstracts (PubMed) and Crossref metadata, checked 2026-09-11; no source opened at figure level",
    "date": "2026-09-11"
  },
  "review": {
    "state": "ai-proposed",
    "date": "2026-09-11"
  }
}
