{
  "type": "question",
  "state": "open",
  "id": "hrm:question/established-scar-remodelling-to-native-architecture",
  "projections": [
    "universal-repair",
    "rejuvenation"
  ],
  "question": "Can a mature dermal scar be remodelled into dermis with native matrix organisation and appendages?",
  "why": "Prevention helps the next wound; reversal helps everyone already scarred, and every fibrotic organ shares the problem.",
  "blocks": [
    "hrm:capability/established-dermal-scar-reversal"
  ],
  "hypotheses": [
    "Scar matrix can be degraded and replaced if the fibroblasts are reprogrammed.",
    "Mature cross-linked matrix cannot be remodelled to native architecture without excision."
  ],
  "whatWouldResolve": "Histological conversion of an established scar to basket-weave dermis with appendages in any adult mammal.",
  "provenance": {
    "proposedBy": {
      "type": "ai",
      "name": "Claude Code session e7dc5601 (Anthropic)",
      "model": "claude-opus-5",
      "session": "e7dc5601-1690-47c6-bf13-9ca150d31960"
    },
    "method": "manual reasoning from the cited sources' abstracts (PubMed) and Crossref metadata, checked 2026-09-11; no source opened at figure level",
    "date": "2026-09-11"
  },
  "review": {
    "state": "ai-proposed",
    "date": "2026-09-11"
  }
}
