{
  "type": "question",
  "state": "open",
  "id": "hrm:question/bbb-really-the-delivery-limit",
  "projections": [
    "universal-repair"
  ],
  "question": "How much of the failure of systemic therapy in glioblastoma is the blood-brain barrier, and how much is that the drugs would not work even at full concentration?",
  "why": "An enormous amount of effort goes into opening the barrier. If the drugs delivered through it are ineffective anyway, that effort is misdirected, and the map should say which of the two problems is binding.",
  "blocks": [
    "hrm:capability/cns-drug-delivery-past-the-barrier",
    "hrm:capability/gbm-targeted-cytotoxic-therapy",
    "hrm:goal/gbm-reaching-the-tumour"
  ],
  "hypotheses": [
    "The barrier is intact around infiltrating cells and is the binding constraint there, even where the enhancing core is exposed.",
    "Concentrations reached in the core are already adequate and the drugs simply are not active against the tumour.",
    "Efflux transporters, not the tight junctions, are the real limit."
  ],
  "knownUnknowns": [
    "drug concentration at the infiltrating margin in patients, which few trials measure",
    "whether ultrasound opening reaches the margin or only the core"
  ],
  "whatWouldResolve": "Phase 0 trials with tissue sampling at the margin: give the drug, resect, and measure the concentration and its pharmacodynamic effect where recurrence starts.",
  "provenance": {
    "proposedBy": {
      "type": "ai",
      "name": "Claude Code session b1762020 (Anthropic)",
      "model": "claude-opus-5",
      "session": "b1762020-2a53-4f0e-8cbd-18239bda19a3"
    },
    "method": "manual reasoning from the cited sources' abstracts (Crossref/Europe PMC), checked 2026-09-14; no source opened at figure level",
    "date": "2026-09-14"
  },
  "review": {
    "state": "ai-proposed",
    "date": "2026-09-14"
  }
}
